"THCIC_ID","HOSP_NAME","HOSP_NAME_clean","HOSP_CITY","HOSP_COUNTY","HOSP_COUNTY_FIPS","HOSP_STATE","YEAR"
"725400","Christus Mother Frances Hospital-Jacksonville","CHRISTUS MOTHER FRANCES HOSPITAL JACKSONVILLE","JACKSONVILLE","CHEROKEE","48073","TX","2022"
"727100","Kindred Hospital El Paso","KINDRED HOSPITAL EL PASO","EL PASO","EL PASO","48141","TX","2022"
"728800","CHI St Joseph Health Grimes Hospital","CHI ST JOSEPH HEALTH GRIMES HOSPITAL","NAVASOTA","GRIMES","48185","TX","2022"
"730001","Texas Health Heart & Vascular Hospital","TEXAS HEALTH HEART VASCULAR HOSPITAL","ARLINGTON","TARRANT","48439","TX","2022"
"736000","Ascension Providence DePaul Center","ASCENSION PROVIDENCE DEPAUL CENTER","WACO","MCLENNAN","48309","TX","2022"
"737000","Clarity Child Guidance Center","CLARITY CHILD GUIDANCE CENTER","SAN ANTONIO","BEXAR","48029","TX","2022"
"739001","Texas NeuroRehab Center","TEXAS NEUROREHAB CENTER","AUSTIN","TRAVIS","48453","TX","2022"
"740000","St Lukes Hospital at the Vintage","ST LUKES HOSPITAL AT THE VINTAGE","HOUSTON","HARRIS","48201","TX","2022"
"744001","Cypress Creek Hospital","CYPRESS CREEK HOSPITAL","HOUSTON","HARRIS","48201","TX","2022"
"747000","River Crest Hospital","RIVER CREST HOSPITAL","SAN ANGELO","TOM GREEN","48451","TX","2022"
"750000","Methodist Hospital for Surgery","METHODIST HOSPITAL FOR SURGERY","ADDISON","DALLAS","48113","TX","2022"
"754000","Glen Oaks Hospital","GLEN OAKS HOSPITAL","GREENVILLE","HUNT","48231","TX","2022"
"755001","West Oaks Hospital","WEST OAKS HOSPITAL","HOUSTON","HARRIS","48201","TX","2022"
"765001","Millwood Hospital","MILLWOOD HOSPITAL","ARLINGTON","TARRANT","48439","TX","2022"
"766000","Medical City Green Oaks Hospital","MEDICAL CITY GREEN OAKS HOSPITAL","DALLAS","DALLAS","48113","TX","2022"
"770000","Ascension Seton Shoal Creek","ASCENSION SETON SHOAL CREEK","AUSTIN","TRAVIS","48453","TX","2022"
"778000","Texas Health Springwood Behavioral Health Hospital","TEXAS HEALTH SPRINGWOOD BEHAVIORAL HEALTH HOSPITAL","BEDFORD","TARRANT","48439","TX","2022"
"781400","Winnie Community Hospital","WINNIE COMMUNITY HOSPITAL","WINNIE","CHAMBERS","48071","TX","2022"
"782001","Intracare North Hospital","INTRACARE NORTH HOSPITAL","HOUSTON","HARRIS","48201","TX","2022"
"784400","Baylor Scott & White Heart & Vascular Hospital Dallas","BAYLOR SCOTT WHITE HEART VASCULAR HOSPITAL DALLAS","DALLAS","DALLAS","48113","TX","2022"
"786200","New Braunfels Regional Rehab Hospital","NEW BRAUNFELS REGIONAL REHAB HOSPITAL","NEW BRAUNFELS","COMAL","48091","TX","2022"
"786800","South Texas Spine & Surgical Hospital","SOUTH TEXAS SPINE SURGICAL HOSPITAL","SAN ANTONIO","BEXAR","48029","TX","2022"
"787400","Baylor Scott & White Medical Center-Frisco","BAYLOR SCOTT WHITE MEDICAL CENTER FRISCO","FRISCO","COLLIN","48085","TX","2022"
"788001","CHRISTUS St Michael Health System","CHRISTUS ST MICHAEL HEALTH SYSTEM","TEXARKANA","BOWIE","48037","TX","2022"
"788002","Harlingen Medical Center","HARLINGEN MEDICAL CENTER","HARLINGEN","CAMERON","48061","TX","2022"
"788003","Christus St Michael Hospital Atlanta","CHRISTUS ST MICHAEL HOSPITAL ATLANTA","ATLANTA","CASS","48067","TX","2022"
"790200","Baylor Scott & White Texas Spine & Joint Hospital","BAYLOR SCOTT WHITE TEXAS SPINE JOINT HOSPITAL","TYLER","SMITH","48423","TX","2022"
"790500","Memorial Hermann Surgical Hospital First Colony","MEMORIAL HERMANN SURGICAL HOSPITAL FIRST COLONY","SUGAR LAND","FORT BEND","48157","TX","2022"
"792000","Texas Orthopedic Hospital","TEXAS ORTHOPEDIC HOSPITAL","HOUSTON","HARRIS","48201","TX","2022"
"792700","Kindred Hospital Sugar Land","KINDRED HOSPITAL SUGAR LAND","SUGAR LAND","FORT BEND","48157","TX","2022"
"793000","HCA Houston Healthcare Mainland","HCA HOUSTON HEALTHCARE MAINLAND","TEXAS CITY","GALVESTON","48167","TX","2022"
"793100","St Lukes The Woodlands Hospital","ST LUKES THE WOODLANDS HOSPITAL","THE WOODLANDS","MONTGOMER","48339","TX","2022"
"794000","Northwest Hills Surgical Hospital","NORTHWEST HILLS SURGICAL HOSPITAL","AUSTIN","TRAVIS","48453","TX","2022"
"794200","Menninger Clinic","MENNINGER CLINIC","HOUSTON","HARRIS","48201","TX","2022"
"794600","Select Specialty Hospital-Longview","SELECT SPECIALTY HOSPITAL LONGVIEW","LONGVIEW","GREGG","48183","TX","2022"
"795000","Nexus Specialty Hospital Shenandoah Campus","NEXUS SPECIALTY HOSPITAL SHENANDOAH CAMPUS","SHENANDOAH","MONTGOMER","48339","TX","2022"
"797100","Doctors Hospital-Renaissance","DOCTORS HOSPITAL RENAISSANCE","EDINBURG","HIDALGO","48215","TX","2022"
"797101","Womens Hospital-Renaissance","WOMENS HOSPITAL RENAISSANCE","EDINBURG","HIDALGO","48215","TX","2022"
"797500","Ascension Seton Southwest","ASCENSION SETON SOUTHWEST","AUSTIN","TRAVIS","48453","TX","2022"
"797600","Ascension Seton Northwest","ASCENSION SETON NORTHWEST","AUSTIN","TRAVIS","48453","TX","2022"
"799001","USMD Hospital-Arlington","USMD HOSPITAL ARLINGTON","ARLINGTON","TARRANT","48439","TX","2022"
"799500","Baylor Scott & White Surgical Hospital Las Colinas","BAYLOR SCOTT WHITE SURGICAL HOSPITAL LAS COLINAS","IRVING","DALLAS","48113","TX","2022"
"800000","Kindred Hospital Tarrant County Fort Worth SW","KINDRED HOSPITAL TARRANT COUNTY FORT WORTH SW","FORT WORTH","TARRANT","48439","TX","2022"
"800010","Houston Methodist West Hospital","HOUSTON METHODIST WEST HOSPITAL","HOUSTON","HARRIS","48201","TX","2022"
"801300","Legent Hospital of El Paso","LEGENT HOSPITAL OF EL PASO","EL PASO","EL PASO","48141","TX","2022"
"801500","Lubbock Heart Hospital","LUBBOCK HEART HOSPITAL","LUBBOCK","LUBBOCK","48303","TX","2022"
"802001","South Texas Health System McAllen","SOUTH TEXAS HEALTH SYSTEM MCALLEN","MCALLEN","HIDALGO","48215","TX","2022"
"802003","South Texas Health System Heart","SOUTH TEXAS HEALTH SYSTEM HEART","MCALLEN","HIDALGO","48215","TX","2022"
"804000","Sunrise Canyon","SUNRISE CANYON","LUBBOCK","LUBBOCK","48303","TX","2022"
"804500","Baylor Scott & White Surgical Hospital-Fort Worth","BAYLOR SCOTT WHITE SURGICAL HOSPITAL FORT WORTH","FORT WORTH","TARRANT","48439","TX","2022"
"805100","Baylor Medical Center Trophy Club","BAYLOR MEDICAL CENTER TROPHY CLUB","TROPHY CLUB","DENTON","48121","TX","2022"
"806002","Cedar Crest Hospital","CEDAR CREST HOSPITAL","BELTON","BELL","48027","TX","2022"
"806500","Tyler Continue Care Hospital","TYLER CONTINUE CARE HOSPITAL","TYLER","SMITH","48423","TX","2022"
"812800","Texas Health Harris Methodist Hospital Southlake","TEXAS HEALTH HARRIS METHODIST HOSPITAL SOUTHLAKE","SOUTHLAKE","TARRANT","48439","TX","2022"
"813100","Texas Institute for Surgery-Texas Health Presbyterian-Dallas","TEXAS INSTITUTE FOR SURGERY TEXAS HEALTH PRESBYTERIAN DALLAS","DALLAS","DALLAS","48113","TX","2022"
"813800","Memorial Hermann Specialty Hospital Kingwood","MEMORIAL HERMANN SPECIALTY HOSPITAL KINGWOOD","KINGWOOD","MONTGOMER","48339","TX","2022"
"814000","Medical City Las Colinas","MEDICAL CITY LAS COLINAS","IRVING","DALLAS","48113","TX","2022"
"814001","Baylor Scott & White Medical Center-Plano","BAYLOR SCOTT WHITE MEDICAL CENTER PLANO","PLANO","COLLIN","48085","TX","2022"
"815300","Texas Health Center-Diagnostics & Surgery Plano","TEXAS HEALTH CENTER DIAGNOSTICS SURGERY PLANO","PLANO","COLLIN","48085","TX","2022"
"816001","Allegiance Behavioral Health Center-Plainview","ALLEGIANCE BEHAVIORAL HEALTH CENTER PLAINVIEW","PLAINVIEW","HALE","48189","TX","2022"
"816300","Solara Specialty Hospitals McAllen","SOLARA SPECIALTY HOSPITALS MCALLEN","MCALLEN","HIDALGO","48215","TX","2022"
"818600","Kingwood Pines Hospital","KINGWOOD PINES HOSPITAL","KINGWOOD","HARRIS","48201","TX","2022"
"820800","Texas Health Presbyterian Hospital-Denton","TEXAS HEALTH PRESBYTERIAN HOSPITAL DENTON","DENTON","DENTON","48121","TX","2022"
"821100","South Texas Rehab Hospital","SOUTH TEXAS REHAB HOSPITAL","BROWNSVILLE","CAMERON","48061","TX","2022"
"822001","Houston Physicians Hospital","HOUSTON PHYSICIANS HOSPITAL","WEBSTER","HARRIS","48201","TX","2022"
"822800","Westlake Medical Center","WESTLAKE MEDICAL CENTER","AUSTIN","TRAVIS","48453","TX","2022"
"823000","Houston Methodist Sugar Land Hospital","HOUSTON METHODIST SUGAR LAND HOSPITAL","SUGAR LAND","FORT BEND","48157","TX","2022"
"823400","St Marks Medical Center","ST MARKS MEDICAL CENTER","LA GRANGE","FAYETTE","48149","TX","2022"
"826800","University Behavioral Health-Denton","UNIVERSITY BEHAVIORAL HEALTH DENTON","DENTON","DENTON","48121","TX","2022"
"829000","Heart Hospital-Austin","HEART HOSPITAL AUSTIN","AUSTIN","TRAVIS","48453","TX","2022"
"829900","North Austin Medical Center","NORTH AUSTIN MEDICAL CENTER","AUSTIN","TRAVIS","48453","TX","2022"
"830000","Cornerstone Regional Hospital","CORNERSTONE REGIONAL HOSPITAL","EDINBURG","HIDALGO","48215","TX","2022"
"831700","Mayhill Hospital","MAYHILL HOSPITAL","DENTON","DENTON","48121","TX","2022"
"832900","Pampa Regional Medical Center","PAMPA REGIONAL MEDICAL CENTER","PAMPA","GRAY","48179","TX","2022"
"835700","St Davids Georgetown Hospital","ST DAVIDS GEORGETOWN HOSPITAL","GEORGETOWN","WILLIAMSO","48491","TX","2022"
"836300","Laredo Specialty Hospital","LAREDO SPECIALTY HOSPITAL","LAREDO","WEBB","48479","TX","2022"
"837800","Hickory Trail Hospital","HICKORY TRAIL HOSPITAL","DESOTO","DALLAS","48113","TX","2022"
"838400","Memorial Hermann Rehab Hospital Katy","MEMORIAL HERMANN REHAB HOSPITAL KATY","KATY","HARRIS","48201","TX","2022"
"838600","St Joseph Medical Center","ST JOSEPH MEDICAL CENTER","HOUSTON","HARRIS","48201","TX","2022"
"839100","Vibra Specialty Hospital","VIBRA SPECIALTY HOSPITAL","DESOTO","DALLAS","48113","TX","2022"
"840000","Mesquite Specialty Hospital","MESQUITE SPECIALTY HOSPITAL","MESQUITE","DALLAS","48113","TX","2022"
"840700","Solara Specialty Hospitals Harlingen","SOLARA SPECIALTY HOSPITALS HARLINGEN","HARLINGEN","CAMERON","48061","TX","2022"
"841300","El Paso LTAC Hospital","EL PASO LTAC HOSPITAL","EL PASO","EL PASO","48141","TX","2022"
"842800","Methodist Mansfield Medical Center","METHODIST MANSFIELD MEDICAL CENTER","MANSFIELD","TARRANT","48439","TX","2022"
"844000","Baylor Scott & White The Heart Hospital Plano","BAYLOR SCOTT WHITE THE HEART HOSPITAL PLANO","PLANO","COLLIN","48085","TX","2022"
"844600","Warm Springs Rehab Hospital-San Antonio","WARM SPRINGS REHAB HOSPITAL SAN ANTONIO","SAN ANTONIO","BEXAR","48029","TX","2022"
"844601","Warm Springs Rehab Hospital Thousand Oaks","WARM SPRINGS REHAB HOSPITAL THOUSAND OAKS","SAN ANTONIO","BEXAR","48029","TX","2022"
"844602","Warm Springs Rehab Hospital Westover Hills","WARM SPRINGS REHAB HOSPITAL WESTOVER HILLS","SAN ANTONIO","BEXAR","48029","TX","2022"
"846100","St Lukes Patients Medical Center","ST LUKES PATIENTS MEDICAL CENTER","PASADENA","HARRIS","48201","TX","2022"
"846200","Covenant Specialty Hospital","COVENANT SPECIALTY HOSPITAL","LUBBOCK","LUBBOCK","48303","TX","2022"
"847000","Texoma Medical Center","TEXOMA MEDICAL CENTER","DENISON","GRAYSON","48181","TX","2022"
"847100","Memorial Hermann Northeast","MEMORIAL HERMANN NORTHEAST","HUMBLE","HARRIS","48201","TX","2022"
"847500","Solara Specialty Hospitals Harlingen Brownsville","SOLARA SPECIALTY HOSPITALS HARLINGEN BROWNSVILLE","BROWNSVILLE","CAMERON","48061","TX","2022"
"848100","PAM Specialty Hospital of Victoria North","PAM SPECIALTY HOSPITAL OF VICTORIA NORTH","VICTORIA","VICTORIA","48469","TX","2022"
"848200","PAM Specialty Hospital of Luling","PAM SPECIALTY HOSPITAL OF LULING","LULING","CALDWELL","48055","TX","2022"
"850300","Baylor Scott & White Continuing Care Hospital","BAYLOR SCOTT WHITE CONTINUING CARE HOSPITAL","TEMPLE","BELL","48027","TX","2022"
"852000","Dell Childrens Medical Center","DELL CHILDRENS MEDICAL CENTER","AUSTIN","TRAVIS","48453","TX","2022"
"852100","Foundation Surgical Hospital-San Antonio","FOUNDATION SURGICAL HOSPITAL SAN ANTONIO","SAN ANTONIO","BEXAR","48029","TX","2022"
"852600","Baylor Scott & White Medical Center Round Rock","BAYLOR SCOTT WHITE MEDICAL CENTER ROUND ROCK","ROUND ROCK","WILLIAMSO","48491","TX","2022"
"852900","Physicians Surgical Hospital-Quail Creek","PHYSICIANS SURGICAL HOSPITAL QUAIL CREEK","AMARILLO","POTTER","48375","TX","2022"
"852901","Physicians Surgical Hospital-Panhandle Campus","PHYSICIANS SURGICAL HOSPITAL PANHANDLE CAMPUS","AMARILLO","POTTER","48375","TX","2022"
"854100","Cornerstone Specialty Hospital Conroe","CORNERSTONE SPECIALTY HOSPITAL CONROE","CONROE","MONTGOMER","48339","TX","2022"
"854400","Central Texas Rehab Hospital","CENTRAL TEXAS REHAB HOSPITAL","AUSTIN","TRAVIS","48453","TX","2022"
"855200","Austin Lakes Hospital","AUSTIN LAKES HOSPITAL","AUSTIN","TRAVIS","48453","TX","2022"
"858300","Cedar Park Regional Medical Center","CEDAR PARK REGIONAL MEDICAL CENTER","CEDAR PARK","WILLIAMSO","48491","TX","2022"
"858600","El Paso Behavioral Health System","EL PASO BEHAVIORAL HEALTH SYSTEM","EL PASO","EL PASO","48141","TX","2022"
"859900","Texas Health Hospital Rockwall","TEXAS HEALTH HOSPITAL ROCKWALL","ROCKWALL","ROCKWALL","48397","TX","2022"
"860600","North Central Surgical Center","NORTH CENTRAL SURGICAL CENTER","DALLAS","DALLAS","48113","TX","2022"
"861300","Encompass Health Rehab Hospital Richardson","ENCOMPASS HEALTH REHAB HOSPITAL RICHARDSON","RICHARDSON","COLLIN","48085","TX","2022"
"861700","Ascension Seton Williamson","ASCENSION SETON WILLIAMSON","ROUND ROCK","WILLIAMSO","48491","TX","2022"
"861900","Kate Dishman Rehab Hospital","KATE DISHMAN REHAB HOSPITAL","BEAUMONT","JEFFERSON","48245","TX","2022"
"862000","Methodist Rehab Hospital","METHODIST REHAB HOSPITAL","DALLAS","DALLAS","48113","TX","2022"
"863300","CHRISTUS Santa Rosa Hospital New Braunfels","CHRISTUS SANTA ROSA HOSPITAL NEW BRAUNFELS","NEW BRAUNFELS","COMAL","48091","TX","2022"
"864600","Carrus Specialty Hospital","CARRUS SPECIALTY HOSPITAL","SHERMAN","GRAYSON","48181","TX","2022"
"865000","The Hospitals of Providence East Campus","THE HOSPITALS OF PROVIDENCE EAST CAMPUS","EL PASO","EL PASO","48141","TX","2022"
"865900","SE Texas ER and Hospital","SE TEXAS ER AND HOSPITAL","HUMBLE","HARRIS","48201","TX","2022"
"866100","Encompass Health Rehab Hospital Round Rock","ENCOMPASS HEALTH REHAB HOSPITAL ROUND ROCK","ROUND ROCK","WILLIAMSO","48491","TX","2022"
"869700","St Lukes Sugar Land Hospital","ST LUKES SUGAR LAND HOSPITAL","SUGAR LAND","FORT BEND","48157","TX","2022"
"871500","Select Rehab Hospital-Denton","SELECT REHAB HOSPITAL DENTON","DENTON","DENTON","48121","TX","2022"
"873200","Baylor Emergency Medical Center at Aubrey","BAYLOR EMERGENCY MEDICAL CENTER AT AUBREY","AUBREY","DENTON","48121","TX","2022"
"873700","Encompass Health Rehab Hospital Vision Park","ENCOMPASS HEALTH REHAB HOSPITAL VISION PARK","SHENANDOAH","MONTGOMER","48339","TX","2022"
"873800","Baylor Scott & White Institute for Rehab-Fort Worth","BAYLOR SCOTT WHITE INSTITUTE FOR REHAB FORT WORTH","FORT WORTH","TARRANT","48439","TX","2022"
"874000","Atrium Medical Center","ATRIUM MEDICAL CENTER","STAFFORD","FORT BEND","48157","TX","2022"
"874100","Methodist Hospital Stone Oak","METHODIST HOSPITAL STONE OAK","SAN ANTONIO","BEXAR","48029","TX","2022"
"902200","Texas Rehabilitation Hospital-Fort Worth","TEXAS REHAB HOSPITAL FORT WORTH","FORT WORTH","TARRANT","48439","TX","2022"
"914000","Kindred Hospital Dallas Central","KINDRED HOSPITAL DALLAS CENTRAL","DALLAS","DALLAS","48113","TX","2022"
"915000","Aspire Hospital","ASPIRE HOSPITAL","CONROE","MONTGOMER","48339","TX","2022"
"919000","Baylor Scott & White Medical Center Sunnyvale","BAYLOR SCOTT WHITE MEDICAL CENTER SUNNYVALE","SUNNYVALE","DALLAS","48113","TX","2022"
"920000","Encompass Health Rehab Hospital Abilene","ENCOMPASS HEALTH REHAB HOSPITAL ABILENE","ABILENE","TAYLOR","48441","TX","2022"
"921000","Ascension Seton Hays","ASCENSION SETON HAYS","KYLE","HAYS","48209","TX","2022"
"923000","St Lukes Lakeside Hospital","ST LUKES LAKESIDE HOSPITAL","THE WOODLANDS","MONTGOMER","48339","TX","2022"
"931000","South Texas Surgical Hospital","SOUTH TEXAS SURGICAL HOSPITAL","CORPUS CHRISTI","NUECES","48355","TX","2022"
"936000","Baylor Scott & White Orthopedic and Spine","BAYLOR SCOTT WHITE ORTHOPEDIC AND SPINE","ARLINGTON","TARRANT","48439","TX","2022"
"937000","Methodist McKinney Hospital","METHODIST MCKINNEY HOSPITAL","MCKINNEY","COLLIN","48085","TX","2022"
"943000","Texas Health Presbyterian Hospital Flower Mound","TEXAS HEALTH PRESBYTERIAN HOSPITAL FLOWER MOUND","FLOWER MOUND","DENTON","48121","TX","2022"
"957000","Carrus Rehab Hospital","CARRUS REHAB HOSPITAL","SHERMAN","GRAYSON","48181","TX","2022"
"969000","Encompass Health Rehab Hospital Sugar Land","ENCOMPASS HEALTH REHAB HOSPITAL SUGAR LAND","SUGAR LAND","FORT BEND","48157","TX","2022"
"969200","Behavioral Hospital-Bellaire","BEHAVIORAL HOSPITAL BELLAIRE","HOUSTON","HARRIS","48201","TX","2022"
"969500","Carrollton Springs","CARROLLTON SPRINGS","CARROLLTON","DENTON","48121","TX","2022"
"969700","El Paso Childrens Hospital","EL PASO CHILDRENS HOSPITAL","EL PASO","EL PASO","48141","TX","2022"
"970600","Encompass Health Rehab Hospital The Vintage","ENCOMPASS HEALTH REHAB HOSPITAL THE VINTAGE","HOUSTON","HARRIS","48201","TX","2022"
"970800","Encompass Health Rehab Hospital Austin","ENCOMPASS HEALTH REHAB HOSPITAL AUSTIN","AUSTIN","TRAVIS","48453","TX","2022"
"971000","Seton Medical Center Harker Heights","SETON MEDICAL CENTER HARKER HEIGHTS","HARKER HEIGHTS","BELL","48027","TX","2022"
"971200","Accel Rehab Hospital of Plano","ACCEL REHAB HOSPITAL OF PLANO","PLANO","DENTON","48121","TX","2022"
"971900","Baylor Scott & White Medical Center McKinney","BAYLOR SCOTT WHITE MEDICAL CENTER MCKINNEY","MCKINNEY","COLLIN","48085","TX","2022"
"972810","Baptist Emergency Hospital Overlook","BAPTIST EMERGENCY HOSPITAL OVERLOOK","SAN ANTONIO","BEXAR","48029","TX","2022"
"972900","Texas Health Harris Methodist Hospital Alliance","TEXAS HEALTH HARRIS METHODIST HOSPITAL ALLIANCE","FORT WORTH","TARRANT","48439","TX","2022"
"972960","PAM Specialty Hospital of San Antonio","PAM SPECIALTY HOSPITAL OF SAN ANTONIO","SAN ANTONIO","BEXAR","48029","TX","2022"
"973000","Baptist Emergency Hospital Westover Hills","BAPTIST EMERGENCY HOSPITAL WESTOVER HILLS","SAN ANTONIO","BEXAR","48029","TX","2022"
"973120","Baptist Emergency Hospital Schertz","BAPTIST EMERGENCY HOSPITAL SCHERTZ","SCHERTZ","GUADALUPE","48187","TX","2022"
"973130","PAM Specialty Hospital of Allen","PAM SPECIALTY HOSPITAL OF ALLEN","ALLEN","COLLIN","48085","TX","2022"
"973160","Austin Oaks Hospital","AUSTIN OAKS HOSPITAL","AUSTIN","TRAVIS","48453","TX","2022"
"973180","Crescent Medical Center Lancaster","CRESCENT MEDICAL CENTER LANCASTER","LANCASTER","DALLAS","48113","TX","2022"
"973240","Oceans Behavioral Hospital Abilene","OCEANS BEHAVIORAL HOSPITAL ABILENE","ABILENE","TAYLOR","48441","TX","2022"
"973290","Arise Austin Medical Center","ARISE AUSTIN MEDICAL CENTER","AUSTIN","TRAVIS","48453","TX","2022"
"973310","Corpus Christi Rehabilitation Hospital","CORPUS CHRISTI REHAB HOSPITAL","CORPUS CHRISTI","NUECES","48355","TX","2022"
"973320","PAM Specialty Hospital of Victoria South","PAM SPECIALTY HOSPITAL OF VICTORIA SOUTH","VICTORIA","VICTORIA","48469","TX","2022"
"973340","Vibra Hospital of Amarillo","VIBRA HOSPITAL OF AMARILLO","AMARILLO","POTTER","48375","TX","2022"
"973350","Vibra Rehabilitation Hospital Amarillo","VIBRA REHAB HOSPITAL AMARILLO","AMARILLO","POTTER","48375","TX","2022"
"973390","Legent Hospital for Special Surgery","LEGENT HOSPITAL FOR SPECIAL SURGERY","PLANO","COLLIN","48085","TX","2022"
"973400","Dallas Behavioral Healthcare Hospital","DALLAS BEHAVIORAL HEALTHCARE HOSPITAL","DESOTO","DALLAS","48113","TX","2022"
"973410","Cornerstone Specialty Hospitals Round Rock","CORNERSTONE SPECIALTY HOSPITALS ROUND ROCK","ROUND ROCK","WILLIAMSO","48491","TX","2022"
"973420","Oceans Behavioral Hospital of Lufkin","OCEANS BEHAVIORAL HOSPITAL OF LUFKIN","LUFKIN","ANGELINA","48005","TX","2022"
"973430","Mesa Springs","MESA SPRINGS","FORT WORTH","TARRANT","48439","TX","2022"
"973450","PAM Rehab Hospital of Victoria","PAM REHAB HOSPITAL OF VICTORIA","VICTORIA","VICTORIA","48469","TX","2022"
"973540","Baylor Emergency Medical Center at Keller","BAYLOR EMERGENCY MEDICAL CENTER AT KELLER","KELLER","TARRANT","48439","TX","2022"
"973550","Baylor Emergency Medical Center at Murphy","BAYLOR EMERGENCY MEDICAL CENTER AT MURPHY","MURPHY","COLLIN","48085","TX","2022"
"973590","ContinueCare Hospital at Hendrick Medical Center","CONTINUECARE HOSPITAL AT HENDRICK MEDICAL CENTER","ABILENE","TAYLOR","48441","TX","2022"
"973610","Baylor Emergency Medical Center at Rockwall","BAYLOR EMERGENCY MEDICAL CENTER AT ROCKWALL","ROCKWALL","ROCKWALL","48397","TX","2022"
"973620","Houston Methodist Continuing Care Hospital","HOUSTON METHODIST CONTINUING CARE HOSPITAL","KATY","HARRIS","48201","TX","2022"
"973640","Houston Methodist St John Hospital","HOUSTON METHODIST ST JOHN HOSPITAL","NASSAU BAY","HARRIS","48201","TX","2022"
"973730","Rock Springs","ROCK SPRINGS","GEORGETOWN","WILLIAMSO","48491","TX","2022"
"973840","Wise Health Surgical Hospital-North Tarrant","WISE HEALTH SURGICAL HOSPITAL NORTH TARRANT","FORT WORTH","TARRANT","48439","TX","2022"
"973850","Resolute Health","RESOLUTE HEALTH","NEW BRAUNFELS","COMAL","48091","TX","2022"
"973860","Altus Baytown Hospital Baytown Medical Center","ALTUS BAYTOWN HOSPITAL BAYTOWN MEDICAL CENTER","BAYTOWN","HARRIS","48201","TX","2022"
"973900","San Antonio Behavioral Healthcare Hospital","SAN ANTONIO BEHAVIORAL HEALTHCARE HOSPITAL","SAN ANTONIO","BEXAR","48029","TX","2022"
"973910","Georgetown Behavioral Health Institute","GEORGETOWN BEHAVIORAL HEALTH INSTITUTE","GEORGETOWN","WILLIAMSO","48491","TX","2022"
"973920","Baylor Emergency Medical Center-Burleson","BAYLOR EMERGENCY MEDICAL CENTER BURLESON","BURLESON","TARRANT","48439","TX","2022"
"973930","CHRISTUS Santa Rosa Hospital Alamo Heights","CHRISTUS SANTA ROSA HOSPITAL ALAMO HEIGHTS","SAN ANTONIO","BEXAR","48029","TX","2022"
"973970","Warm Springs Rehab Hospital Kyle","WARM SPRINGS REHAB HOSPITAL KYLE","KYLE","HAYS","48209","TX","2022"
"974150","Woodlands Specialty Hospital","WOODLANDS SPECIALTY HOSPITAL","THE WOODLANDS","MONTGOMER","48339","TX","2022"
"974220","Baylor Emergency Medical Center-Mansfield","BAYLOR EMERGENCY MEDICAL CENTER MANSFIELD","MANSFIELD","TARRANT","48439","TX","2022"
"974260","Westpark Springs","WESTPARK SPRINGS","RICHMOND","FORT BEND","48157","TX","2022"
"974270","Select Specialty Hospital Dallas (Downtown)","SELECT SPECIALTY HOSPITAL DALLAS DOWNTOWN","DALLAS","DALLAS","48113","TX","2022"
"974290","Haven Behavioral Hospital of Frisco","HAVEN BEHAVIORAL HOSPITAL OF FRISCO","FRISCO","COLLIN","48085","TX","2022"
"974350","PAM Specialty Hospital of Texarkana North","PAM SPECIALTY HOSPITAL OF TEXARKANA NORTH","TEXARKANA","BOWIE","48037","TX","2022"
"974360","PAM Specialty Hospital of Corpus Christi North","PAM SPECIALTY HOSPITAL OF CORPUS CHRISTI NORTH","CORPUS CHRISTI","NUECES","48355","TX","2022"
"974370","Houston Behavioral Healthcare Hospital","HOUSTON BEHAVIORAL HEALTHCARE HOSPITAL","HOUSTON","HARRIS","48201","TX","2022"
"974390","HCA Houston Healthcare Pearland","HCA HOUSTON HEALTHCARE PEARLAND","PEARLAND","BRAZORIA","48039","TX","2022"
"974470","Laredo Rehabilitation Hospital","LAREDO REHAB HOSPITAL","LAREDO","WEBB","48479","TX","2022"
"974490","Medical City Alliance","MEDICAL CITY ALLIANCE","FORT WORTH","TARRANT","48439","TX","2022"
"974500","Oceans Behavioral Hospital of Katy","OCEANS BEHAVIORAL HOSPITAL OF KATY","KATY","HARRIS","48201","TX","2022"
"974530","PAM Rehabilitation Hospital of Clear Lake","PAM REHAB HOSPITAL OF CLEAR LAKE","WEBSTER","HARRIS","48201","TX","2022"
"974620","Cross Creek Hospital","CROSS CREEK HOSPITAL","AUSTIN","TRAVIS","48453","TX","2022"
"974680","Weslaco Regional Rehab Hospital","WESLACO REGIONAL REHAB HOSPITAL","WESLACO","HIDALGO","48215","TX","2022"
"974720","ContinueCare Hospital at Medical Center Odessa","CONTINUECARE HOSPITAL AT MEDICAL CENTER ODESSA","ODESSA","ECTOR","48135","TX","2022"
"974730","Texas Rehab Hospital of Arlington","TEXAS REHAB HOSPITAL OF ARLINGTON","ARLINGTON","TARRANT","48439","TX","2022"
"974820","Memorial Hermann Orthopedic and Spine Hospital","MEMORIAL HERMANN ORTHOPEDIC AND SPINE HOSPITAL","BELLAIRE","HARRIS","48201","TX","2022"
"974910","Baylor Scott & White Surgical Hospital at Sherman","BAYLOR SCOTT WHITE SURGICAL HOSPITAL AT SHERMAN","SHERMAN","GRAYSON","48181","TX","2022"
"974940","Baylor Scott & White Medical Center Marble Falls","BAYLOR SCOTT WHITE MEDICAL CENTER MARBLE FALLS","MARBLE FALLS","BURNET","48053","TX","2022"
"974980","Legent Orthopedic + Spine","LEGENT ORTHOPEDIC + SPINE","SAN ANTONIO","BEXAR","48029","TX","2022"
"975000","Weatherford Rehabilitation Hospital","WEATHERFORD REHAB HOSPITAL","WEATHERFORD","PARKER","48367","TX","2022"
"975010","Our Childrens House","OUR CHILDRENS HOUSE","DALLAS","DALLAS","48113","TX","2022"
"975020","TrustPoint Rehabilitation Hospital of Lubbock","TRUSTPOINT REHAB HOSPITAL OF LUBBOCK","LUBBOCK","LUBBOCK","48303","TX","2022"
"975111","Medical Center of Southeast Texas Beaumont Campus","MEDICAL CENTER OF SOUTHEAST TEXAS BEAUMONT CAMPUS","BEAUMONT","JEFFERSON","48245","TX","2022"
"975112","Cleveland Emergency Hospital","CLEVELAND EMERGENCY HOSPITAL","CLEVELAND","LIBERTY","48291","TX","2022"
"975121","JPS Health Network - Trinity Springs North","JPS HEALTH NETWORK TRINITY SPRINGS NORTH","FORT WORTH","TARRANT","48439","TX","2022"
"975122","CHI St Lukes Health Springwoods Village","CHI ST LUKES HEALTH SPRINGWOODS VILLAGE","SPRING","HARRIS","48201","TX","2022"
"975124","Sun Behavioral Houston","SUN BEHAVIORAL HOUSTON","HOUSTON","HARRIS","48201","TX","2022"
"975129","First Baptist Medical Center","FIRST BAPTIST MEDICAL CENTER","DALLAS","DALLAS","48113","TX","2022"
"975130","AD Hospital East","AD HOSPITAL EAST","HOUSTON","HARRIS","48201","TX","2022"
"975138","Memorial Hermann Pearland Hospital","MEMORIAL HERMANN PEARLAND HOSPITAL","PEARLAND","BRAZORIA","48039","TX","2022"
"975139","Medical City Frisco","MEDICAL CITY FRISCO","FRISCO","COLLIN","48085","TX","2022"
